{
  "schema": "dumbmoney.ollama-runtime-evidence.v1",
  "evidence_kind": "STATIC_INSTALLATION_ATTESTATION",
  "state": "TEMPLATE",
  "evidence_id": "TO_BE_RESOLVED",
  "release_id": "TO_BE_RESOLVED",
  "verified_at": "TO_BE_RESOLVED",
  "verified_by": "TO_BE_RESOLVED",
  "verification_status": "TO_BE_RESOLVED",
  "process_identity": "DumbMoneyOllama",
  "process_identity_kind": "NON_SERVICE_LOCAL_ACCOUNT",
  "process_identity_sid": "TO_BE_RESOLVED",
  "windows_service": false,
  "credential_targets": [],
  "secret_refs": [],
  "broker_authority": "NONE",
  "remote_model_auth": "NONE",
  "executable_path": "TO_BE_RESOLVED",
  "executable_sha256": "TO_BE_RESOLVED",
  "executable_bytes": 0,
  "listener_host": "127.0.0.1",
  "listener_port": 11434,
  "listener_owner_identity": "DumbMoneyOllama",
  "listener_owner_executable_path": "TO_BE_RESOLVED",
  "listener_owner_executable_sha256": "TO_BE_RESOLVED",
  "model_provider": "ollama",
  "model_tag": "TO_BE_RESOLVED",
  "model_digest": "TO_BE_RESOLVED",
  "model_store_path": "C:\\ProgramData\\DumbMoney\\ollama\\models",
  "model_store_owner_identity": "DumbMoneyOllama",
  "model_store_owner_sid": "TO_BE_RESOLVED",
  "model_store_acl_sddl": "TO_BE_RESOLVED",
  "model_store_acl_sha256": "TO_BE_RESOLVED",
  "model_store_manifest": [],
  "model_store_manifest_sha256": "TO_BE_RESOLVED",
  "network_allowlist": [
    "loopback:dopey"
  ],
  "external_egress": false,
  "use_time_revalidation_required": true,
  "use_time_revalidation_fields": [
    "process_id",
    "process_identity",
    "process_identity_sid",
    "executable_path",
    "executable_sha256",
    "listener_owner_process_id",
    "listener_owner_identity",
    "listener_owner_process_identity_sid",
    "listener_owner_executable_path",
    "listener_owner_executable_sha256",
    "model_provider",
    "model_tag",
    "model_digest"
  ]
}
